{"schema_version":1,"model":"ecmwf_ifs025","cycle":1792843200,"key":"36_-122","times":[1792843200,1792854000,1792864800,1792875600,1792886400,1792897200,1792908000,1792918800,1792929600,1792940400,1792951200,1792962000,1792972800,1792983600,1792994400,1793005200,1793016000,1793026800,1793037600,1793048400,1793059200,1793070000,1793080800,1793091600,1793102400,1793113200,1793124000,1793134800,1793145600,1793156400,1793167200,1793178000,1793188800,1793199600,1793210400,1793221200,1793232000,1793242800,1793253600,1793264400,1793275200,1793286000,1793296800,1793307600,1793318400,1793329200,1793340000,1793350800,1793361600,1793383200,1793404800,1793426400,1793448000,1793469600,1793491200,1793512800,1793534400],"lat0":35.75,"lon0":-122.25,"dlat":0.25,"dlon":0.25,"nlat":7,"nlon":7,"sea":"8cMGDBAAAA==","fields":{"u10":{"scale":0.01,"data":"6gDdAJkA2v92/0QAMgDkAJ8AdgC7/yIACQDH/4AAfQCJ/xkAGQD2/9r/WgDO/+f/AADO/wAAHACr//P+Mf/E/9H/OAAiAKv/1P/5/+D/PgA7APn/rv8ZAPb/NQDtAFoAcwDIALsAnwCZ/07//f8TAMIA4QBaAL7/LAADALv/YQDOAIn/MgAGALj/3f/I/3n/2v/k/9r/9v/6/wn/tf4A/6v/uP/9/wwAkv/I//r/uP/h/xMA5/9a/0UA/f/w/x8AHAAfALoA5QB4AHgAvf+B/xcAoQDsAHsAiwBy/wsA7/8tANYAgQDP/6T/IQAqADD/Zf+U/6D/JwDi/2X/4v62/qr/+P/1/5H/kf8BAP7/tv8BAHv/Sf+5/4v/HQCBAPX/Yv+n/0kARAEcATIBGQHnAJL/9v8vAQMBlf+ZAD7/IgBjAAYB1wCPAL7/kv/d/4wA5AAcAS4ADwASAEQAaf/dAGQBIgFnAIkApf9j/5MBywAxABUAef+M/93/+f/q/4YAQQAP/9f/QQB7AXUBTAEnAbAANgC5/18BNwGaAH4AzP8EAMkATAHvAJoArf8qAHgAqgCLAckAiwDJAJ0AQAA5/+IB8gEIAeUAwwA//3v/3AG6AF8AswCj/8z/zP8tAP7/XABAAD//0v8XANsAAAEiATsB8P9RAAYA5ADeAAkBHAAvACwAjP/XAD4A1//h/04AUQDd/yIBhgDq/1cANQC1/+T/pgHFAKL/3f8cAJ//LwCZAGf/6v/9/+3/LwAPAIb/AAATAOT/LwBRACgAXQFBAVAB3QCO//X/8v9dAUEB8wDH/wUABQCe/1MB4wCu//n/HgDj/8D/8wCh/8r/1v/g/7f///9p/2L+Tf+h/5v/qv80ALH/qv/8/+b/2f8OAFkAcv/y/9b/3P9dADoAIQA1ASsBKAFjAIn/AwD5/0gBPgHnANH/EgD2/6j/xAAiAKL/GAADAOb/sf9t/yL///+G/9H/tP/2/6j/Iv9j/6v/bf+u/yIA2v/m/yUA5v+4/w8A+f+f/wkA1P/q/0QAKwDU/4oBYQEZARwAff8AAAwARQH0AIkAu/8JAPr/pf9eAAAAjP8WAAkA7f/B/+T/ev/t/23/uP+7//f/FgDa/jv/if9w/6//JQDq/9T/AADO/5z/CQADAKz/CQC4/9f/HwATAN7/NQEfAQkB9v+C/+3/AgD5AJ8AHwCu/xIA6f+S/7EAGwCY/yIABgDN/4//VADw/xsAcP+V/8r////5/yj/R/+F/1f/tP8lAP///P8GAMr/q/8YAPn/8/8SAMH/2v9aAAwAt/8pAUsBLAEMAbsA4P8PABkBHAFqALIAj//U/10A1ACZAG0A1/+A/yIA+f+JAFoAVwDE/7X/TgAJAOEAxP9OADIAVAD5/5L/uAAoAAkALwADAJz/2v9nAOT/TgArAHP/0f/U/7sBogGGAWABygCoAJIAcAFjAeYAzQBEAAUAYAACAdcAuwDB/yf/sf+CAM0A1ABaAHwAJQBsAMf/IgEYAfYA6QC3ABUAQP8PAWkAggCSAKIAU//T/7cA//9BAHAAAv9d/5v/jQFoAZ0BtgHIALYAkwCHAYoBIwGsAJMAnQDYAIEBUgG/AOT/CgCg/zYAtgFbAesA7gAQAWgAo/+/AZoClwEjAVsBPABq/1IB6wCWAKYABAH9/2EAwgAKAKYA2ABh/4f/9/+4ANgA3gAjARMAfQAfALUAvADVABAAOwA4AKX/nABxAOT/CQBCAHoA9/+1AO3/5P8fACwA0f8JAAMBAAEWAPf/DQA4AEsAuAD6/87/vv9eAJ8AkwD6//r/5/8TAM4AqQCyAMYBzwGaAVgBHQBCAPT/swGRAV8BdwA5AAEA0v9oARcB4f8jABMA7v/M/08BlwABAFsACgDx/yYAPAF7Aff/9P8QABcAGgCzAO7/9P/+/1UAlwDVAP7/BwDb/zMAEQHSALkAcwG3AcEBuwH//zcAFQBaAWkBsQGSAC4AKwD8//8A0wDW/wgAJwD1//X/0ABZAAIAJAAVAP//HgDsAAgBnv/s/+n/OgAeAE0Ax//T/+D/UACCAJUA/P8uAOD/GwAFAYIAqwAoAXMBjAFaAcT/NAAVAAkBVAF5AU0ANAAVAN3/1wClALf/KAAhAO//6f/QAMoAAgBNACgAAgAhACgBTQCS/+//CABNACgALgCL/w8AGwBsAH8AvgDW/y4ANABzABsBjADKAPEAFwFiAR0Bpv8pAP7/8QAwAWgBHQBPAEkAIwDMAL8As/8QAEkASQDe/2gAbv/+/zYA/v/3/zYAaAAE/2H/v//r/3QAPADx/9L/EAAKAGgAaAB0AOX/SQBoAJQA3wApAIcARAFQAeYBzQE3AN//lQAkAUQBKwK0AI7/UADZAHUAdQC6AJv/PQALAWMASgBW/zcAugC0AHUABQDgAEn/GABQALQAxwC6//kA+P9vAI4A4ABvAFwAzQAqAAsBtABD/8b/fABdAaIBYwI+AuAAtP+CAFAB1AGoAjcBMf9pANMAGAFpASUBgv+IAF0B8wBEAewASgAMAfMAggBW/2oCNwExAZUA4ACVAAsASgJpAJsAMQGhAAsAtAAlAQsA8wC0AN/+PQC0ACACqgLiArYCDQEAAD8AUgJ+AoQDUgGW/3EAAQE5AiYC7gCj/8IAzwE/AaoC+wFFAV4BdwGvAKP/qgL7A0wCEwEHASABPwD0AWsBUgA5AWUBRQCpADMBlgABAdUA9P5SAJAAJwJ4Ar0CNAM5ACcA6ADpAekB3ALDABQAwwCdAJEBOgH7/wEAcgBAAcP/pAEIAV8ApACwADkA6P/QAckBWQDD/2UAcgDDABoBawAtAJ0ARgCEANYAnQBfAFkAwwBfAGUAsACPAe0BcAJEApX/NwDTAIIBqAElAj0ARACVAEQAVwHsAM3/RACbAKgA2f9wAWkAPQBvAEoA7P/5/5sBKwHs////RABEAIIAEgELABIAJAA3ADEAlQB8AGMARACVAMEAbwDNAF8BnQFAAlIBWP8NAHEARgFSAaoBAQBGAEwABwDcALwAl/9GAJcAOQDV/+4APwAUAD8AIADJ/w0ADgEaAIT/7v/u/z8AWACwALb/+//7/zMAnQAgAFgARgA5AHEAtgBYACYANAF5AfwBhQBA/wIATQAVAW0BuAEIAEcAQQDW/8QA0ACY/zoAhQD8/93/pQB///z//P/p/6T/FQAuAAL/Tf/K/6v/CABBAN3/q/8VANb/IQBBAGwAyv86ACgA7/8oAEEAkgCDAWoB1AEZAFf/EgBXAFEBcAGQAcf/XQBdANT/4QDzAJz/EgAfAPP/4P8ZAAz/5//t/8H/2v8MALX/wf4l/5X/lf/a/2QAlf/U/wYA1P8AACsAcACo/zIA5//5/10AMgCJAL8BegGsAWEBCQC+/1sAmQE8AesB5ACG/ykAmQDeAKYA5ACs/8v/ZwBCAP3/0f/3/04ATgApAMv/OwA7/xYASAA1AJn/6v+4ACIAIgA7AAMA0f90AFQA0f9hABAAbf/9/2cA8QHYATACIwIKAVv/bgDYAcYBYgJVAS//TwCaAJQBNgFbAXT/IwCsALMAmgEKAWEAvwCsADwAVf8EAmIBFwGsAJoAxf/S//gBxQBuAIEA5P+y/1sA3gDL/6YASAAj/x0AKQAhAjoCeQJgAiEBl//7/+8BNALKAi0BeP8aAJcA3AF/AeIAeP+RAAgBtwDjAUYBvQAUAU0BQABS/xUC0AL1ANwA1gDP/zMA6QHQAEYAngAzAL3/kQDJABoAsABlAEb/eAA6AMwBFwI9AmICYgAqAAoArQHAAW8CoABVAAQA/v+nAT0B6//4/1wArQDM/9MBYgE8AI4AmgDY/9//swGCAgoA6/9DACoAaAD+ADAAuf8XADAAXADGAHUASQA2AB0ASQCaAEMAqwHjAS4CIgLW/w4AfwClAZgBKAJ5ADQAQADQ/38BIQHK//X/UwAbAND/jAHpAFMARwAhAMr/4/+MAS4Byv/K/wgACABAAOkA3P8nAA4AFQBNAJIAUwAnAPz/ZgCeAIsAiwAlAX0B8wFwAXb/EgBKAB8BVwGvASsAMQArAM3/8wCuAMH/DAB2ADEA2v/HACUA//8MAP//wf/z/5wAtP9w/+D/8//z/xgAPgDH/ysA8/8GAEoASgBRAD4A8/8YAJUAJQBRACUBMQGVAYIAVv8kAFAABQESARIB5v8rAB4A4P+oAF0AtP8SAD0ABQDy/3wAgv/5////7P/s/wsAPQAY/1b/0//m//L/EgALAMf/GADm/zEAKwAeAAUAVgDm/z0A2gA3AFYAQQE7AZ8BeQB5/w8AGwBBAeMAYAEIADoAFQD2/wkBTQDW/wIADwDv//z/pQBZ/y4AIQAIACEAFQBzABv/U//p/xUALgAVAC4AxP80AO//QQAoACEAUwBgAO//fwC3AFoAfwBEAT4BgwFEAfn/rv8rACsB8wDaAdQAdv8xAK4AgwBXALsAtP/a/5wAPgAfAKL/UQCJAHwASgDH/z4AUP8fACUAOAAGALv/GQEYAAwABgCVAM3/HwDgAB8AiQBqAIn/wf///5UBqAH5AecBDAHz/+D/jwGoAV0CRAFE/+b/4ABjAVEBRAGb/wUARACJAGoBHwHaABgB5gCoAOz/2gEAAlcBKwHzAJsAY//UATgBqACVADEB2v///zgBHgB8AOAAlf+6/+z/nwH8ARUC4wGxAEcA1v+xAdcBxAL8AH//DwDpAGYBVAHQAH//kgA7AekAhgEVAasAIgFHAcoAmP/qAdECbQHjAPYAsQC9/3kBIgFHAJgAGwHdAJIAAgFNALcAvgDd/zQA4/9SAb0BAQLWAe7/FAB4AFIBZQE6Al8AJgAzAEwAOQHcAOj/z/9GAMkAz/9SAc8ABwB4AGsA+//V/1IB7wE/AOL/FAA/AFIAnQAtALb/GgBlAJ0A7gBMAFIAOQB4AHgAcQDVAN4BEAI7AvcBvv8oAGcA6gHLAU4CZwAiAAMA8P/FAU4BFQD8/zUAIgCr/7IBFgFHAEEAHAC4/+P/vgEcAcT/1/8cAPz/HADqAA8AIgBHAEEAZwBtAEEALgAcAFoA0QAiAJkAqwHdARsC1gG9/wIA+/+YAb0BTQJ4ABQA7/8bAGYBJwEIAOL/NABGAOL/WQGqAC0AbAA6AAIA7/9yAScBw//v/+//OgAIAMMAFAAUABsATQA6AEYAWQA0AEYAeACRAO//WQAAASUBjwHgAI//JQAxAOcAAAFkAfP/PgBEAEoAqABqAJX/BgBKANoA+f/HAOb/2v8GAB8AOAAGAPkAif9Q/4n/8/+cABgAcADU////1P84ADEAdgAMAB8AGABwAEQAJQCoAHkBtwECAqsApP/K/wIAYAGYAZ4B7/80ABUAyv8VAQIBAgAnAAIACADv/+kAkgAIAPz/7//c/xUADwEnAJH/0P8VADQAIQC9AA4AOgAOAFkAIQAuALcAeQBNAJIAcgAVAJgAPAFVAY4BdABPANL/oP8jASoBYgFoAL///v9VAN8AoADlAKb/6/+aAGgA5QB7AJQA8QDfAKAA2P9iAYEAWwBoAJoAxgCN/yMBbgBVAJoA/gBoADYA/gBVAMYA5QAEAOX/PAAaAS0B9QBrAHgABwAaAAgBRgFyAeIAiv8gAH4A7wAtARQBiv9MAHgApAAaARQBfgDDAL0AwwAgAIUBAQGRAGsAsACwAKP/IQEBAEAAsAAOAQEBsAC2AEAAvQCEAAf/7v9AAJ0BrwHoAT8BfQC8AF4AawGKAVICEwGv/xkAyAAyASAB1QB9/6MAAAHhAEUBUgHCAA0BJgG8AGr/WAENArUAwgDnAJAAWAAyAX0ASwC8AKMAgwB9ANsAMgCpAFgAqf93AA0AjQGsAbMBNgEDADUAEABVAXoBBAJ0AEgAFgDrADwBCgE8AN7/YQAWAQoANgHxAFUAkwB6AC8A0f9uAaYBHAADADUAoABbAOQAegA8AGEAWwAjAI0AZwB0AJMAxQBuADUAkwBkAWQBdwEmASz/ff8sABMBLAGjATIABgD6//T/1QC1AO3/wv8mAHcAwv8HAUUAWACDAGQAWAAZADIB2wDI/+f/XgDCABkArwAGAAYAWACQADgARQAsAF4ARQC8AIoAHwA/AHgBkQH7AVIBXv+w/4oAMwE5AQgCawDb/xoAIADuAJcA6P/C/18AlwDi//UAOQAUAEYAPwAUABoA7gA/AH7/BwAUAKoA+/9GAOL/FAA/AGsAPwABAML/eABYALYAkQDb/wcAhAGKAfUB+wBx/wEAkAAzAQ0B3AE/AAEAXgB+AKMAawD6/8L/ZQDJADMAXgD6/wEAawBrAEwADQBFAAcAqf8NAIoAsAABANX/+v8/ACwAXgAsADMAiv9FAF4AqQBFAAcAWABbAVsB0gE8AbL/FgC5AC8B8QAXApMA9/+ZAIAA2AA8AGcAsv/YADYBmQCTAKz//f+/ALkAKQC4/4AApv/x/1sApgCNAKb/5ABVAGcAmQCTALL/uP+mAAoA0gC5AG3/sv9CAFoBmAEJAk4CRwEIAMr/WgGMAWACLgEIAFMAUwBaARUB1wCY/9AAcwFaAfwBCQECAS4BFQGMAGb/0QFOA8QBFQHdACEAmP+SAdcANAAVAQkBef/K/wIBcwAiAZ4AIf9TAJL/bQFgAZIBAwICABUAhgAuASIBTgFmAEEAVAAuAPwAcwDj/yIAjACYAKv/qwAVAA8AcwAoABUA6f+MAFQA3f/2/00AFQAoACgACQACABsA8P9HAHkAvv9aACgAZgCGACIAjACqAZcBGgJfAZb/MwBFAC0BTAHiAV4AIAANACwA6ADJAAcA9P9SADMA4f/PAAEA+v8sACAAyP/0/50A+v+2/wEAMwDu/wcAEwDb/w0ABwAgAPr/+v+2/zkAIABxAEwA1f9FACkBbQG4AXQBgABBAFoACQFUAfEBOwHE/ygA0QD3AP0A3gAPAPD/WgB6AOoA1wB6AJMAsgBzAEgAFgFtAE4AmQC+ANEAAwDkAHoAZwBnAOQA6v8cAOQAHABtAPcAAwBz/1oAsQHQAeMBeQLEAToBmAC3AcoB7wGxAcP/OgAhAcQBcgEnAb0ALQByAZ4BtwGFAS4BYAF/AVMBWQH2AXkC1gGSAaQB9gF5AVMBhQHvAAIBkgHjAekAJwGYABUBUwH1/3j/TP9cAW4BIwGHAYf/PADxAFUBEQHSAEIAQgBPAGIANgG5AKz/MABJAPf/2P/SAG4A/v9CAPH/HQBJAJoAgQDF/8z/MABPAIEAxf/3/xAAEAAXAEIAbgDY/zYA3v9oAPEAMAAjAGEBVQF6AEgAgP9CAKAAdAEKAer/y/+NAG4A/f9uAWEAev9IAG4ANQDF/woBhv/9/wMA5P9CAFUAy/8W/0L/y//9/zwAVQBt/8v/FgDY/xAASACZAN7/KQDY/2EAdABnAMsA"},"v10":{"scale":0.01,"data":"kv12/UH+Sv9N/6v/zv+F/Wb9t/6S/9f/x/+o/7f9xP2M//b/GQD8/9T/Lv5B/1EAAACD/+f/IgDa/i4AIgAVACsAUQAPAET/rv++/8f/PgBkAA8A4/8MAAMAkv8oAC4AEgDq/eT9V/5F/1T/2/8fAJL9rv0i/+H/zv/9/9T/ov2y/aL/6v8cABwA1P9E/nD+RQATAML//f8pAG3/uP+///H/KQAGAAAAsv9e/5D/5/8GABkA4f+s//r/1P8i/wAAAwAKAAn+LP4Z/7kAz/+m/xoA8P0p/mf/igANABYAPAAQ/lv+kAD0/8X/dAB0AL/+dP6W/x0AWwAzAKD/xf/C/4r/6//0/yMASACaAFUA6P8jAPT/GgAsACz/Vf/e/0wAigBMAN7/h/6d/nj/1v89ANP/FwCj/p3+8v9cAHIAOgBvALD+o/6LAOz/wP+IANkA+/7S/iT/3/+kAHgAXP+L/wH/e//G/6r/zP8aAJT/pwBsAC0A5f+9/wgATP9l/5r/iwAqABcAz/9m/lT+bf7N/t3//f+r/3D+bf75/gMAjAArAGcAY/52/v3/1/9q/wkAegA7/k7/jP9q/zgAUQCA/y7+H//n/yUAav+i/9H/q/5qAGQAegDa/9H/lf84/2f/gP9zAJ//c/+D/+T95P0N/lH+Yf8mABMA9P2v/ZP+qf/l/6b/xf8G/uf9oP/3/53/ZP/l/+H9sv5SAOH/BP+8/wQAKf3C/ocAMwDV/+7/+v9C/n3/nf/+/+v/4f9x/7P/9//h/9X/wv9F/0X/Zf5V/kb+4v5v/6T/8v9J/i3+6/7Q/+//yf/W/zn+cv6q/xcACwAIAOL/Af71/3gAJwDG/9b/MADW/lYACwAOACEAGwAFAKr/Q/9o/8P/5f8kAOn/CwAhAP7/6f8FACEACwBf/mn+hf7p/mz/3f8VAFD+i/4u/83/4/8CAOn/F/4h/7T/GAAVAAgA2f8O/lP/LgBNAPL/7/8xAPj+R//v/yEATQA9ABgAfP9T/2//vf/Q/xUA7/8LABgA7//Q//b//P/5/3P+7f5H/1T/VP/g/w8Aaf5g/wkAzv/w/wMA4/9X/oz/xP8cABUABgDR/6j+O/9OAFoABgDz/yUAfP/j//P/KwBHACsAHADE/5j/jP/E/7H/DwAZAA8AOAD8/8T/8/8GAB8Afv7c/p7/t/9Z/+X/HgBy/u/+NADQ//L/HgDl/2j+FP/i/yoAHgAXAMn/h/5Z/1MAaQAbAAIAPQA2/2z/1v86AFwAQwAXAIv/zP+z/7r/qv/+//7/CAAhAP7/vf/v/wgANwB4/nX+9f6n/3IAIQD4/4H+jv5//0AAdQAkAHUAgf7v/oIATQDT/yoAtwC6/ov/i//4/80A4ADf/+n++P/W/zoAjgB1AOb/Yv+LAFYAPQD1/73/4/8IANb/5v+OADcA+P8FAAL/6f7//pj/lQDmALcAKv/1/kD/QAD5AMQA2gAx//L+dgALAJv/sQDmACr/hf9K/3j/kgAeAeP/Hv/v//X/4P9NAIIAsf+C/7QAtwC6AFkAuv/y/ycAwP/g/9oAVgALAB4Arv5m/n/+ef7w/7sABgGu/pL+bf7E//oALAE+Adf+qP72/9r/GP/RAKIA7f6f/7v/A/+l/5wAwf/X/nb/DwAvAFf/xP/R//z+UQCGAIMAjADw/